comment_id,username,comment_date,time_delta_since_upload,comment_text
ct_1,@lisamanning5954,2018-08-30T04:31:02+00:00,"11 days, 8:41:35",Awesome! Wish I could of been there!
ct_2,@derhanswurst23,2018-08-29T08:22:45+00:00,"10 days, 12:33:18",I was there and it was soo cool :DI was even crowdsurfing and in the walls of deaths
ct_3,@FlashBastard1964,2018-08-28T05:12:53+00:00,"9 days, 9:23:26",I think the singer looks and sounds like a young Mike Reno (Loverboy).
ct_4,@alejandroalcalacastillo4923,2018-08-26T15:05:52+00:00,"7 days, 19:16:25",in live they sound great
ct_5,@neverse6979,2018-08-26T10:54:42+00:00,"7 days, 15:05:15",OMG Jacoby's vocals are fuckin insane!!!! Better than ever
ct_6,@luis_ernesto7138,2018-08-25T20:18:08+00:00,"7 days, 0:28:41",VIVA LA CUCARACHA
ct_7,@SteffiStuber,2018-08-25T18:24:06+00:00,"6 days, 22:34:39","War dabei, war live richtig fett \m/ SB 2018! :D"
ct_8,@nekx2793,2018-08-25T16:18:03+00:00,"6 days, 20:28:36",This  tour in 2018 reminds me that Iam metalhead and this scream is the best painkiller for my heart JACOBY WE FUCKING LOVE YOU MEN AND CHESTER YOUR VOICE AND SONGS WILL STAY IN OUR HEARTS MEN ROCK AN ROLL IS NEVER DEAD
ct_9,@Flocket.Monster_TCG,2018-08-24T16:07:40+00:00,"5 days, 20:18:13",Werden eigentlich nach und nach alle Bands von der Main stage hochgeladen? Da waren nämlich noch ein paar die ich mir nochmal gerne ansehen würde 🙈
ct_10,@callanerd3104,2018-08-23T11:07:05+00:00,"4 days, 15:17:38",Ich glaube Livestream war nicht so eine gute Idee. Die Konzertaufnahmen die aus Zeitgründen im nachhinein in Ruhe abegemischt werden können haben bei Rockpalast eine viel viel bessere Qualität. Ich bin selbst Musiker und weiß wieviel schwerer es ist einen Live Stream im Gegensatz zu einer Aufnahme abzumischen. Man muss nur mal die anderen Rockpalast Aufnahmen von Papa Roach mit dieser vergleichen und hört den riesigen Unterschied. Ich war auch selbst mal im WDR Studio wo die Aufnahmen abgemischt werden und weiß dass das ein riesiger Unterschied zum Ü Wagen ist.
ct_11,@royantelo3933,2018-08-23T03:29:14+00:00,"4 days, 7:39:47",Que conciertazo!!! Papa Roach los unicos que siguen haciendo Rock
ct_12,@RegnumJagos,2018-08-22T21:14:16+00:00,"4 days, 1:24:49","Leider war ich nich so begeistert von Papa Roach, hatte mir mehr erwartet, sound war bescheiden, und nur okay, mehr hiphop elemente als sonst was dabei, aaaber ist schließlich alles geschmacksache, die pits warn so, naja, viele wussten nich was ein moshpit ist hab ich das gefühl gehabt bei papa roach, aber hab sie nun einmal gesehn, reicht dann auch ^^"
ct_13,@CeciShaw,2018-08-22T19:11:47+00:00,"3 days, 23:22:20",The drums sound great!
ct_14,@achimwitcoustic9585,2018-08-22T15:22:04+00:00,"3 days, 19:32:37","Periscope worked so well live. Cool song2 version, too.The old infest songs are live still fresh. And the newer stuff fits great. FEAR is awesome as well"
ct_15,@achimwitcoustic9585,2018-08-22T14:42:45+00:00,"3 days, 18:53:18",They survived Nu metal and transformed to a great rock band.
ct_16,@miqueiasmartins1052,2018-08-21T12:29:16+00:00,"2 days, 16:39:49",FUCK YEAH
ct_17,@di-kin9342,2018-08-21T08:06:43+00:00,"2 days, 12:17:16","Послушал половину первой песни. Выключил потому что все ноты спеты мимо, а так в целом круто конечно"
ct_18,@D7RE.,2018-08-21T06:33:13+00:00,"2 days, 10:43:46",So happy that Jacoby sounds better than ever.
ct_19,@Resifreak90,2018-08-20T20:20:59+00:00,"2 days, 0:31:32",Absolutes Highlight <3 ultra Stimmung und Performance
ct_20,@NITROOOY,2018-08-20T18:04:13+00:00,"1 day, 22:14:46",Danke Rockpalast für eure geile Arbeit!
ct_21,@xxdrumfreakxx281,2018-08-20T13:34:58+00:00,"1 day, 17:45:31",Ich brauche unbedingt ein Haartutorial von Jacoby! Will auch so ne Frise😂🤘🏻
ct_22,@xxdrumfreakxx281,2018-08-20T13:30:13+00:00,"1 day, 17:40:46",Aaaaaaaah ich will sie unbedingt wieder Live sehen!!!!!
ct_23,@theandiller,2018-08-20T12:51:52+00:00,"1 day, 17:02:25",Totally one of our best hopes for keeping rock alive
ct_24,@RammsteinJoey,2018-08-20T07:48:15+00:00,"1 day, 11:58:48",Also ich war ja ganz vorne dabei im und um den Moshpit herum und der Sound war absolut Bombastisch. Irgendwie enttäuscht mich aber der Sound hier im Stream. Scheißegal...Ich war dabei und es war GEIL!
ct_25,@catharinageiger3112,2018-08-19T20:08:04+00:00,"1 day, 0:18:37","Es war einfach greil! Und die Crowd war ja mal fucking sick!! Geiles Breeze, absolut bestes Festival, nächstes Jahr auf jeden Fall wieder"
ct_26,@jesslair4055,2018-08-19T17:56:15+00:00,22:06:48,"Geniale Show und wir vermissen Chester auch! Als er darüber sprach, dass auch er diese Dunkelheit und Abhängigkeit kennt und sein Herz bei all den Menschen im Puplikum ist, denen es genauso geht, war ich kurz vor einem Rohrbruch im Tränenkanal. Danke für diese Worte und die geile Show, Papa Roach, das gibt mir Kraft!"
ct_27,@niclasniedermaier6621,2018-08-19T17:49:12+00:00,21:59:45,@1:20:37 The Croud
ct_28,@kartentricks1,2018-08-19T13:27:06+00:00,17:37:39,"An die Breeze Besucher: gibt es noch mehr hier, die heulen mussten, als plötzlich In the end gesungen wurde? Bei ""Rest in Peace chester Bennington"" war es vorbei bei mir😅Aber hammer Abschluss. Vermiss das Breeze jetzt schon. Bis nächstes Jahr 🤘"
ct_29,@walu1g1,2018-08-19T10:29:59+00:00,14:40:32,2:19 Crooked Teeth5:24 ...To Be Loved8:54 Getting Away With Murder12:40 Between Angels And Insects18:23 Face Everything And Rise22:34 Gravity27:10 Periscope30:58 Broken Home (with Lose Yourself Intro)36:04 My Medication39:45 Help43:30 Traumatic50:31 Song 253:15 Forever (with In The End Outro)57:36 R.I.P. Chester Bennington and Depression Speech58:32 Falling Apart1:02:44 Born For Greatness1:08:53 Scars1:12:34 None Of The Above1:16:18 Last Resort (with Infest Bridge)
ct_30,@009w00t,2018-08-19T10:01:34+00:00,14:12:07,56:27Rip Chester
ct_31,@josefjager852,2018-08-19T09:14:08+00:00,13:24:41,Lost my watch( worth around 250 €) in the first few moments in the pit. Still the best day in my entire live so far! Love You papa Roach!!
ct_32,@JorgeSalazar-ny1ri,2018-08-19T03:13:36+00:00,7:24:09,Worst crowd ever.
ct_33,@beyondoblivionz9329,2018-08-19T02:30:51+00:00,6:41:24,Being in the battlefield was fucking amazing! Summer Breeze 2019: ICH KOMME!!!
ct_34,@gustavovelasco426,2018-08-19T01:08:44+00:00,5:19:17,Conciertazo de Papa Roach!! 🙌🏻 like si hablas español XD
ct_35,@yvonneresetka202,2018-08-18T22:20:46+00:00,2:31:19,Ich war dabei 🤘
ct_36,@17Firefoxxx,2018-08-18T21:01:52+00:00,1:12:25,Anybody know the songs?
ct_37,@asdcwhynot,2018-08-18T20:54:30+00:00,1:05:03,great band live !!!!! new metal for life !!!!!
ct_38,@bastiansilva7353,2018-08-18T20:28:01+00:00,0:38:34,Viva La Cucaracha!!!!!!
