comment_id,username,comment_date,time_delta_since_upload,comment_text
ct_195,@JacobAnawalt,2025-01-04T06:26:47+00:00,"14 days, 10:53:47","I believe that we are all paying the price now for the overspending by governments world-wide to save those on the door of death from COVID-19. Of course there are many systemic issues at hand, many which are the result of 5, 10, 15, and 30 years worth of social pressure and government direction, but this overspending seems to have been the trillions that have broken the camel's back and ground us into the mud."
ct_196,@luisrueda6109,2025-01-03T22:25:00+00:00,"14 days, 2:52:00",Such a loving family. Something I never had. You are rich without knowing.
ct_197,@pnketia,2025-01-03T21:32:38+00:00,"14 days, 1:59:38",This is what happens when society pushes everyone to higher education.  You get an over supply of highly educated people and an under supply of good paying jobs for them.  You cannot expect those highly educated people to work low paying jobs that those without degrees have.  Businesses are constantly looking for ways to cut labor cost in favor of profits.
ct_198,@QBZ1123,2025-01-03T20:28:16+00:00,"14 days, 0:55:16","NEET is not a new concept in industrialized countries, if you compare NEET rates across countries China's number does not stand out."
ct_199,@Nephrotreego,2025-01-03T19:59:16+00:00,"14 days, 0:26:16",This guy's Chinese pronunciation of place names is truly abysmal. Can you at least try and get the sounds right?
ct_200,@kleindavid9416,2025-01-03T18:05:56+00:00,"13 days, 22:32:56","Say what you want, but I respect that Erchui guy - he found a way to works hard without completely destroying himself, he works a lot but not a crazy amount, he has a side hustle that actually provides some value, his bigger dreams have a chance to come true - even if he might be a tad too optimistic. Still, trying to come by without abusing others"
ct_201,@fishermansbuddy3785,2025-01-03T10:56:57+00:00,"13 days, 15:23:57",In germany many big companies do layoffs due to a lack of demand for their products. This is focussed on automobile business and chemicals. Others are quite stable.
ct_202,@Woof514,2025-01-03T10:42:30+00:00,"13 days, 15:09:30","I just stopped watching this. Blsht western antipropaganda! This guy is ""poor"" with his iphone and choosing suitable job. I got my MD in electrical in 2013, post 2008 in Croatia (lasted until ca 2018), i had old used LG phone, living in my family home and earning 600€/month. Not nearly enough to go through a month! While unemployment was close to 30%. That's bad. This guy is spoiled brat"
ct_203,@PauloConstantino167,2025-01-03T08:38:03+00:00,"13 days, 13:05:03",19:56 they have a statue of Trump how cute
ct_204,@jeff0247598,2025-01-03T05:34:09+00:00,"13 days, 10:01:09",What is the Chinese Dream?
ct_205,@thomasspatz8888,2025-01-02T22:17:18+00:00,"13 days, 2:44:18",ARTE! Do you use a dark filter?
ct_206,@SaretGnasoh,2025-01-02T16:06:28+00:00,"12 days, 20:33:28",Ah typical western media smearing propaganda 😅
ct_207,@whatsgreataboutchina1375,2025-01-02T16:04:12+00:00,"12 days, 20:31:12",good documentary. but as such a big station: can you get the city names right? it is not so hard to pronounce correctly. I can help you or just use google.
ct_208,@edgarkuijer5755,2025-01-02T15:56:56+00:00,"12 days, 20:23:56",Authoritarian regimes are fundamentaly weak because they don't tolerate any critical feedback. They won't admit mistakes and cannot change for the better.
ct_209,@theboredprogrammer1114,2025-01-02T13:20:49+00:00,"12 days, 17:47:49","Us millenials and gen z all over the world are subjected to these hard economies in our countries, yet governments have the audacity to be alarmed that we don't get married or have children like it used to be. It seems like there's a class crisis and cost of living crisis globally."
ct_210,@basshunterdota625,2025-01-02T07:22:52+00:00,"12 days, 11:49:52",Same is the case in other asian countries when we have too much people with degrees it's bound to happen.
ct_211,@meyligo,2025-01-01T13:04:25+00:00,"11 days, 17:31:25","It isn't possible that there will be no unemployed in a country. Of course jobs are not enough, that is why it is better that people have lands to plant on because when you don't have a job you are still eating. People that only have citylife cannot eat without a job. There is no land to survive on. Not everyone is meant to be in the city, some people needs to be in the simple lands because the city is already full of people and if all lands becomes city, there will be no more farms to plant on."
ct_212,@sumitvashishtha5183,2025-01-01T10:22:25+00:00,"11 days, 14:49:25",Why don't you talk about your own countries instead of running anti-east campaigns!
ct_213,@cladnow,2024-12-31T16:48:06+00:00,"10 days, 21:15:06","Journalism nowhere pays. Doesn't really matter if its from China or Harvard or Stanford. It's not engineering, medicine, Law, business ,eco and sciences"
ct_214,@gf5617,2024-12-31T10:21:34+00:00,"10 days, 14:48:34",1 billion+ people cant sell their imaginations?!????Made In China social guidance🙈🙉🙊
ct_215,@SelineSharon,2024-12-31T07:27:28+00:00,"10 days, 11:54:28","Nothing wrong to work in the field. Farming is big business too, you know. People needs food everyday."
ct_216,@YanQi.,2024-12-31T04:47:09+00:00,"10 days, 9:14:09","China is so big and rich, why do the locals even need to work. They only need to grow anything behind their house they already have food. 😅😅😅"
ct_217,@therazakshow1264,2024-12-31T01:44:07+00:00,"10 days, 6:11:07",Do not find a job but create it
ct_218,@DressingUpDollyLady,2024-12-31T01:05:44+00:00,"10 days, 5:32:44",but they are doing well. how else would that subway train be running? someone has a job. how would they all have bikes? someone is building and the citizens bought them. how are their clothes staying clean? they clearly can pay to wash clothes and bathe. how else do they have all the latest technology shining bright on the buildings? someone built them. so they can't be doing that bad.... a part from when they try to withdraw money out of their own bank accounts........
ct_219,@Beru700,2024-12-30T20:58:34+00:00,"10 days, 1:25:34","The problem is not the government but the people, the Chinese people are so  a lot of population   also Resources is a not enough all Chinese people that not everyone can find money and work."
ct_220,@gren1977,2024-12-30T20:01:31+00:00,"10 days, 0:28:31","man, i really wish politics didn't get in the way of progress, or our lives as individuals. we are all working hard to feed our families, then some asshat in power thinks they've got ambitions and have to ruin it for everyone. billionaires are bad enough, politicians are worse... nevermind billionaire politicians :P"
ct_221,@Tony63716,2024-12-30T10:17:07+00:00,"9 days, 14:44:07",Have you got your share in 1.6 billion dollars lies from US yet.https://www.youtube.com/watch?v=QcpCQLYthX8
ct_222,@Tony63716,2024-12-30T09:09:41+00:00,"9 days, 13:36:41","Education is to train how you think and optimize your talents in different sectors.Rapid technological change may not help pressing social needs, and despite rising connectivity, many feel lonely and voiceless. Many of such deep transformations require not only local, but also global solutions. Education systems are certainly influenced by these trends, but they also have the power to affect them. For example, schools are called to help children develop the types of skills, knowledge and competencies required of a 21st century global labour market, but they should also help prepare the new generations for creating the jobs of the future, those that do not exist yet. What these recent trends mean for each education system is a pressing and open-ended question for policy makers, teachers, parents, and students who are ultimately responsible for the future of education in a world characterized by uncertainty, diversity, and rapid changes.Reply"
ct_223,@Tony63716,2024-12-30T09:07:59+00:00,"9 days, 13:34:59","Education is to train how you think and optimize your talents in different sectors.Rapid technological change may not help pressing social needs, and despite rising connectivity, many feel lonely and voiceless. Many of such deep transformations require not only local, but also global solutions. Education systems are certainly influenced by these trends, but they also have the power to affect them. For example, schools are called to help children develop the types of skills, knowledge and competencies required of a 21st century global labour market, but they should also help prepare the new generations for creating the jobs of the future, those that do not exist yet. What these recent trends mean for each education system is a pressing and open-ended question for policy makers, teachers, parents, and students who are ultimately responsible for the future of education in a world characterized by uncertainty, diversity, and rapid changes.Reply"
ct_224,@soy-l9k,2024-12-30T07:18:54+00:00,"9 days, 11:45:54",i tot every country having the same problem
ct_225,@Tony63716,2024-12-30T06:03:19+00:00,"9 days, 10:30:19",Their life and education is much better then US
ct_226,@RobertSutton-n2q,2024-12-30T05:39:51+00:00,"9 days, 10:06:51",CCP numbers are faked chinese economists have even said youth unemployment in china is 47% and then they were punished
ct_227,@mageedays,2024-12-30T02:30:50+00:00,"9 days, 6:57:50",Yeah right. That's china now.😅
ct_228,@Max1stMolar,2024-12-30T01:43:51+00:00,"9 days, 6:10:51",why doesn't this journalist hide the names and faces of the interviewees? these interviewed might be in danger
ct_229,@Jojo-vv9ue,2024-12-29T13:37:52+00:00,"8 days, 18:04:52",The pronunciation of the names make me cringe. Kyen Kyen? 🤐
ct_230,@artetvdocumentary,2024-12-29T12:34:52+00:00,"8 days, 17:01:52","Youth unemployment is an issue across the world. What's the situation like in your country? 🌎For an alternative viewpoint, check out our film 'Back to Bulgaria'. When Bulgaria 🇧🇬 joined the European Union 🇪🇺 in 2004 many young Bulgarians went abroad to find work leaving the country depopulated.Here, we follow those who are now coming back to start businesses in their homeland. Check it out 👉 https://www.youtube.com/watch?v=tcDRCYOvN5s&t=1s"
ct_231,@praveenm6204,2024-12-29T09:24:37+00:00,"8 days, 13:51:37",CCP is betraying its own people for decades😢😢😢
ct_232,@thesailingkiwi,2024-12-29T07:15:21+00:00,"8 days, 11:42:21",makes my $16k a month seem excessive
ct_233,@Krush0-0,2024-12-29T05:18:52+00:00,"8 days, 9:45:52",I lived in China for the last 17 years and have traveled to India before.  These 2 most populous countries set the worse example for socialism and democratic system.
ct_234,@CollDott,2024-12-29T02:35:03+00:00,"8 days, 7:02:03",China has Obey No Dream!!😅😅😅😅
ct_235,@CollDott,2024-12-29T02:26:52+00:00,"8 days, 6:53:52","Correction: there is No longer ""middle class"" in China!! They have been wiped out totally due to housing debt!!"
ct_236,@CollDott,2024-12-29T02:20:16+00:00,"8 days, 6:47:16",Def more than one in five!!! I saw a young girl kneel on their side walk begging for money!! A young girl that resorted to begging due to complete hopelessness of getting employed!! Unimaginable that authoritarian administration would create this magnitude of poverty!! Shame!!
ct_237,@user-zo6xg8bx4l,2024-12-28T23:26:33+00:00,"8 days, 3:53:33","FAFO!!!!!   CCP China can have peace and prosperity, or war (or threaten war), but, NOT BOTH. When CCP China began threatening war over Taiwan and claiming the S. China Sea as their sovereign territory (to the CHEERING of the Chinese people) with its Wolf/Warrior diplomacy, the West realized that depending on CCP China for their supply chains was a FOOLS GAME...along with investing in and trading with CCP China. Also, don't forget China's support of Russia's immoral war in Ukraine!! So, ALL of the Chinese citizen's jobs. directly and indirectly reliant on foreign trade or investment, are OVER. This is the direct result of the EVIL. CRININAL, and IGNORANT CCP."
ct_238,@vriusxi5940,2024-12-28T20:58:55+00:00,"8 days, 1:25:55",支已爆，將近亡党亡国
ct_239,@IlovemysonTboy,2024-12-28T20:49:00+00:00,"8 days, 1:16:00",Like how the old Chinese man said to his son ' we are in a cycle and all we are doing our whole lives is pulling a cart' who doesn't feel like that in a capitalist social or any modern societys.
ct_240,@mrdanielleebrown,2024-12-28T14:31:51+00:00,"7 days, 18:58:51",The military wants the youth in these war hungry countries. Unemployment drives youth military enlistment without forcing a draft. You get a more willful soldier. Drafts produce soldiers with negative attitudes towards war.
ct_241,@mariorico440,2024-12-28T13:12:36+00:00,"7 days, 17:39:36",Come to America . Americans need more Chinese restaurants and liquor stores.
ct_242,@Jay-nq1wh,2024-12-28T03:13:23+00:00,"7 days, 7:40:23",The little pee pee China “men” syndrome 😂
ct_243,@Jay-nq1wh,2024-12-28T03:12:36+00:00,"7 days, 7:39:36",All the American’s with their huge dongs are stealing all these Asian women from the China “men”😂
ct_244,@Jay-nq1wh,2024-12-28T03:12:19+00:00,"7 days, 7:39:19",All the American’s with their huge dongs are stealing all these Asian women from the China “men”😂
ct_245,@Jay-nq1wh,2024-12-28T03:09:44+00:00,"7 days, 7:36:44",Inadequate 3 incher China “men”😂
ct_246,@Jay-nq1wh,2024-12-28T03:09:09+00:00,"7 days, 7:36:09",Little wee wee China men😂
ct_247,@Jay-nq1wh,2024-12-28T03:08:37+00:00,"7 days, 7:35:37",Weak 3 incher China “men” 😂
ct_248,@gladegoodrich2297,2024-12-28T02:39:10+00:00,"7 days, 7:06:10",Walmart built China!Now they are leaving and buying from other countries.China is toast.
ct_249,@Birdsfly11,2024-12-27T22:56:15+00:00,"7 days, 3:23:15","The main problem in China is not the people who want to work, it's Xi Jinping and his lies about how bad his economy is really doing. Wake up young people and take your future from the gangsters in Beijing or you'll live chasing a dream that will never materialize! The world sees what Xi wants to hide as sure as the earth spins and the sun rises!"
ct_250,@cobra1010,2024-12-27T22:19:22+00:00,"7 days, 2:46:22",Also this aggressive country with its dictator-leadership has to learn that massive growth and expansion can come to an end. Or at least be interrupted.
ct_251,@natkojurdana9673,2024-12-27T21:26:12+00:00,"7 days, 1:53:12","I find it fascinating that under Chinese socialism there are no state pensions for people outside main cities. In my home country Croatia (which had socialism during Yugoslavia) we still have state pensions for every worker. It is often not much, but even people who never worked get some minimal amount each month after they turn 65. That is definetly not enough to cover all daily expenses, but many people rely on family/relatives and some have a little side-hustle.My point being - what kind of socialism is that when you don't provide social benefits for your people? That's socialism in name only!"
ct_252,@chrishouseman4781,2024-12-27T18:07:59+00:00,"6 days, 22:34:59",The difference between China and the US is China will develop jobs for these people and make sure they're cared for
ct_253,@user-rama-56,2024-12-27T17:49:23+00:00,"6 days, 22:16:23","Stupid propaganda! It would be better if you talked about the disillusionment of Western European youth, it's much more relevant."
ct_254,@henriktranvanhien7021,2024-12-27T17:09:44+00:00,"6 days, 21:36:44","As usual, communist and/or dictatorial governments don't want others to tell stories about how tough lives are for their struggling citizens. They want people to live in a rosy virtual reality in which good and better things are abundant."
ct_255,@ataksnajpera,2024-12-27T15:01:40+00:00,"6 days, 19:28:40",I hate that monotonous AI voice!
ct_256,@almurabitun,2024-12-27T14:07:30+00:00,"6 days, 18:34:30",The Chinese are the most brutal race
ct_257,@Alan-megan,2024-12-27T13:12:18+00:00,"6 days, 17:39:18",what do people expect? 1.45billion people and everyone live happy ever after??
ct_258,@MikeHunt-rh1rp,2024-12-27T11:46:50+00:00,"6 days, 16:13:50",A journalism qualification in China is about as useful as a chocolate teapot... complete oxymoron unless you're pushing propaganda for the CCP😄
ct_259,@scalawag6878,2024-12-27T11:02:31+00:00,"6 days, 15:29:31","China is a failed state that has absolutely zero to offer the world. The fact that some people believe that China is a first world nation is completely preposterous. China will continue to decline because of it's  insanely stupid ideas about one child policy and trying to strong arm the world into Chinese ways of thinking, which are intellectually bankrupt."
ct_260,@j_klumpp,2024-12-27T09:14:18+00:00,"6 days, 13:41:18","The censorship is very real in China but this reporting takes it a little far in their bias toward the government. The characters in the video are great and very true to life but the narration comes across as grabbing at every opportunity to take a jab at the party and ""Xi."" Good video, but could definitely use with some more objective narration (and better pronunciation of names). Also poverty is existent in China but as far as I've seen (I live here) there's no abject poverty to the extent of starving or freezing, aka ""surviving"" is not a challenge."
ct_261,@smldis,2024-12-27T08:04:32+00:00,"6 days, 12:31:32","Ok, but why showing milan central station in Italy at minute https://youtu.be/9S7gULymU2A?si=FaB5rHkMBk51Az56&t=1089"
ct_262,@pabsswede8740,2024-12-27T07:01:49+00:00,"6 days, 11:28:49",That guy's parents have not a single grey hair?!?!!?
ct_263,@brunbeero5106,2024-12-27T06:19:53+00:00,"6 days, 10:46:53","Okay so this is happening to us all. We don't have to wait for any other country to ""fall"" in this job reality. What are governments waiting?"
ct_264,@chrissmith7837,2024-12-27T04:48:09+00:00,"6 days, 9:15:09","Anyone in the knowledge business is going to struggle in this environment, and China will have the biggest problems, faster than other countries, because of its pace of modernisation. Smart guy, wrong major. There are fewer and fewer good majors for the immediate future. Culture is in the middle of an explosion."
ct_265,@shallperngte6977,2024-12-27T02:13:57+00:00,"6 days, 6:40:57","What's the point of you lying every day, China is still getting stronger and stronger, but you are becoming more and more despised"
ct_266,@jamesbarry1673,2024-12-27T02:02:13+00:00,"6 days, 6:29:13",I word to the wise it's just not China
ct_267,@vikk-u7w,2024-12-27T01:00:18+00:00,"6 days, 5:27:18","Also worth noting that China is facing a historic drop in births and a population decline as well. Which means the local market is not strong, hence the external focus. Yet outside China, the global economy isn't strong enough either. Its a lose-lose unless you're already rich."
ct_268,@CausticLemons7,2024-12-26T23:44:11+00:00,"6 days, 4:11:11",I'm appreciative of these individual stories because we often see a focus on industrial and economic moves. These help keep us grounded about what those spreadsheets really mean at the end of the day.
ct_269,@OverTheSevenSeas,2024-12-26T23:26:39+00:00,"6 days, 3:53:39","How many journalism majors in the West find a 'suitable' job within any given time frame? It is irrelevant if anyone is part of the 'elite' through educatio, if they chose a major that doesn't convert well to employability then the education wasn't a good match for the job market. (I am a proponent that education for educations sake IS worth it, but one can't then complain that the knowledge acquired isn't bringing in a salary.)I don't think that this young man was necessarily your best example. Presenting his case up as an example of how (in your estimate) China is failing doesn't hold up well. As a journalism major he probably had classes in digital marketing. He may have to choose a solopreneur path.p.s. I also checked on the statement that a cup of coffee costs $6 in Beijing. That is a little over 40 yuan. Google tells me that Starbucks charges 41 yuan. But coffes starts from 7 yuan at fast food places to 20-30 for a better coffee. It is unfair to quote the highest price available and imply that it is THE going price across the city."
ct_270,@Randombourg,2024-12-26T23:21:42+00:00,"6 days, 3:48:42","Who would pay 6eur for a coffee, even in the EU!"
ct_271,@yuchenliu6062,2024-12-26T22:19:27+00:00,"6 days, 2:46:27","People born between 1990 - 2000 were a very unique generation. They grow up during an once in a century economic miracle, with big dreams and high hopes for a better future. Most of them are now suffering from a devastating blow of unemployment. Generational wealth evaporates overnight. Without a doubt they have seen the better days of China and knows what we are heading into. Xi wants this entire generation gone so that he can turn to China into a communism power house just like soviet."
ct_272,@runePV,2024-12-26T22:05:59+00:00,"6 days, 2:32:59",the growth of china's economy is staggering .. you cannot ask more from a country then that.. it's not a chinese problem at all.. it is ours
ct_273,@tinaf1739,2024-12-26T18:56:06+00:00,"5 days, 23:23:06","My grandmother would say that many of you wanted everything (a good, easy job, a better life, etc.) too quickly. And a lot of things were done on credit, which doesn't work out well.🤑"
ct_274,@TerrenceMayson,2024-12-26T18:32:03+00:00,"5 days, 22:59:03",Ill pay  to watch u buy  lunch on tik tok  sure thing
ct_275,@grahamkearnon6682,2024-12-26T17:56:34+00:00,"5 days, 22:23:34",Loving the CCP paid comments! Say hello to Paddington for me.
ct_276,@grahamkearnon6682,2024-12-26T17:49:59+00:00,"5 days, 22:16:59","Its the 21st century, why am I having to read translations."
ct_277,@iamgabriel5823,2024-12-26T17:30:20+00:00,"5 days, 21:57:20",Communism will always fail.
ct_278,@JMACCSArmiesOfMiddleEarth,2024-12-26T17:02:41+00:00,"5 days, 21:29:41",It's happening everywhere not just China
ct_279,@neoflying,2024-12-26T16:44:50+00:00,"5 days, 21:11:50",So Chinese in mainland can pray …Communist are able to destroy religion completely
ct_280,@naveedsarwar85,2024-12-26T15:01:15+00:00,"5 days, 19:28:15","I was impressed by visuals of jobless individual, the apartment, the breakfast etc., I wonder how its bad, young people in journalism degree will require for sure more time to find job anywhere"
ct_281,@RevoOnRev1337,2024-12-26T14:45:04+00:00,"5 days, 19:12:04","青年梦大,资源不够"
ct_282,@fightthepower4648,2024-12-26T14:34:42+00:00,"5 days, 19:01:42",YouTube video: Global Declaration of Independence - Fight the Power
ct_283,@BrandonB99999,2024-12-26T14:09:53+00:00,"5 days, 18:36:53",Global depression is beginning
ct_284,@Baldnesz,2024-12-26T14:01:42+00:00,"5 days, 18:28:42",Bitcoin will set you free !
ct_285,@MohamedHassan-ji1gp,2024-12-26T08:47:18+00:00,"5 days, 13:14:18",Wouldn't be a good idea to look for work in a different country.
ct_286,@wwbren,2024-12-26T06:19:36+00:00,"5 days, 10:46:36",And you don't even dare to do a similar program on France and Germany? Tidy up your own house first before putting others down.
ct_287,@wojiaobill,2024-12-26T06:12:43+00:00,"5 days, 10:39:43",Xi Jinping is a useless c*nt. The Chinese Communist Party is a joke.
ct_288,@acepath3001,2024-12-26T04:41:28+00:00,"5 days, 9:08:28",too many people on the planet.
ct_289,@lvjungle2840,2024-12-26T04:08:41+00:00,"5 days, 8:35:41","As a person who speaks 5language. I wonders what is the solutions to have good life for everyone? Every counties has it own Major problem, like USA. Have job but all money goes to bills and you get generation can’t afford house  while China has this problem"
ct_290,@tymistry,2024-12-26T01:23:46+00:00,"5 days, 5:50:46",The amount of bias in this... the 97 people that didn't want to speak with you are smart! They don't fall for this Western propaganda always painting China like some failing dystopia where everyone is a slave or something lol
ct_291,@binbin988,2024-12-26T00:31:21+00:00,"5 days, 4:58:21",How about you quit smokeing theb that'll save you some money and dont smoke in fornt of a camera you dirty countrymenPS ITS YUAN NOT EUROS ....
ct_292,@cesar5390,2024-12-26T00:27:39+00:00,"5 days, 4:54:39","Many European countries have adjusted their methods of counting unemployment to present a more favorable picture. A few years ago, youth unemployment in Spain exceeded 40%. If young people opt to continue their studies or take part in subsidized training programs, they are excluded from the unemployment statistics."
ct_293,@threesixnine369six,2024-12-25T23:28:37+00:00,"5 days, 3:55:37","Come on ARTE, I'm sure you can do better with the narrator's pronunciation 😅 if not, I offer my services as a coach, but you can also look it all up on the internet for free 💖"
ct_294,@Xenon-4300,2024-12-25T23:19:23+00:00,"5 days, 3:46:23",You just know the three people who are willing to speak on camera about this are absolutely brooding underneath.
ct_295,@TheBaronMunchusen,2024-12-25T23:04:31+00:00,"5 days, 3:31:31",And they forgot how to farm.
ct_296,@threesixnine369six,2024-12-25T22:51:12+00:00,"5 days, 3:18:12","1:35 addressing the youth telling them to be strong and build a socialist utopia while squeezing them dry in one of the most intense neo-confucian money-driven competitive societies on earth, in a way programming them for a drop in standards of living, caused by bad policies, making way for hijacking any social uprising and taking credit for it, like a highly advanced parasite. Xi and the CCP are working hard on how to make China even more dystopian, oppressing and depressive, spending a lot of energy in hiding and patching problems instead of addressing them."
