comment_id,username,comment_date,time_delta_since_upload,comment_text
ct_96,@TheChefDWC,2025-01-23T07:41:18+00:00,"33 days, 12:08:18","I'm the son of a Chinese immigrant who was among the first group of Chinese to emigrate to the United States after the U.S. repealed the anti-Chinese immigration act in 1943. If you study the history of China, the CCP has fallen into the same trap that led to the fall of previous Imperial Dynasties. They have fallen out of touch with the people. Their government prints lies about how everything is peachy keen. Most recently they claimed that business growth is up by 5%. Given how their economy is imploding, this can't possibly be true.Millions of Chinese citizens hold toxic mortgages for properties that were never completed by developers and/or were substantially overvalued. Some of these properties were also tofu dreg projects that were built with substandard materials in violaton of the law. Home owners have not had their concerns addressed by the government.In recent years, between 2022 and 2023, some 600,000 account holders lost their savings from by bank embezzlements and fraud schemes that were perpetrated by four rural banks in Henan province. Some 40 billion yuan ($8.5 billion) was lost. Although these accounts were supposed to have been insured by the government, reimbursement to the account holders was not forthcoming because the government decided that this was a civil matter and not the fault of the bank.Every major developer in China has gone into bankruptcy. Many of these companies were over leveraged. The failure of these developers has had a ripple effect throughout the economy affecting other businesses like steel producers and furniture makers.Although the government says that they want foreign investment, they tell their citizens that foreigners are not to be trusted. New security laws have made it easier for the government to seize intellectual property and to detain foreigners. Regulations are constantly changing which makes it difficult for businesses to operate.Fresh water supplies have been contaminated by pollution and nothing is being done to address this problem. Those water supplies which remain relatively clean have been unevenly distributed. Approximately 80% of China’s freshwater resources are located in the south, while the north, which is home to major cities and industrial centers, suffers from limited water availability. For instance, the JingJinJi region (Beijing, Tianjin, and Hebei) has an annual per capita water availability below 184 cubic meters, which far below the threshold for water scarcity.China has serious issues but the CCP insists that everything is fine. The government elites have the best of everything while the poor suffer and the increasingly bad economy erodes the middle class. Things have gotten so bad that some government employees haven't been paid in months!Back in the 90's, the government reached out to many families that had left China. They offered to return our confiscated property if we woud only return to the motherland. Nobody in my family thought that this would be a good idea. Nothing over the past three decades has changed my mind regarding the quality of life in China."
ct_97,@bookman2407,2025-01-22T15:11:03+00:00,"32 days, 19:38:03",The delivery driver is doing better than the University graduates
ct_98,@AntonOfTheWoods,2025-01-22T10:22:20+00:00,"32 days, 14:49:20","The problem is the same everywhere. Parents build up their kids' expectations, and governments allow young people to get degrees in fields that don't require workers. That's fine, but unless you are really, really brilliant, your Media Studies degree doesn't qualify you for anything but cleaning tables at McD's. But virtually zero people are willing to go and clean toilets if they managed to get a degree. Somehow they believe society *owes* them a cushy, well-respected job. And their parents take far too long to realise they were doing their ""little prince(ss)"" a massive disservice."
ct_99,@plungecastnz,2025-01-22T05:55:26+00:00,"32 days, 10:22:26","Poverty is here for the average Chinese mainlander.The working and middle class ""hiding in cafe's pretending to go to work"".Graduates born in 2002 (correction) are no longer getting employed or able to find work. Thats millions of highly educated grads.The CCP tried to bite the hand that feeds (the West & Western Companies) using it's finances gained through Intellectual Property Theft and using it's Belt & Road initiative to influence poor countries believing it's propaganda about wanting to help but using loans to steal and influence it's political clout in the West.Thus taking small countries voting power at the United Nations to gain unjust influence in the South Pacific, Latin America and Africa and the Middle East.All this is finally coming to light and the smaller countries citizens are turning against their Chinese overloads. A little to late if you ask me. As they now already have a foot hold in these poor nations political through bribes and business spies."
ct_100,@jefpduct8725,2025-01-22T01:14:25+00:00,"32 days, 5:41:25","I think the young Chinese people are like the Lenin of yesterday’s history. Only, they want free of speech and equal opportunity. And get rid of the CCP. It’s really just a matter of time."
ct_101,@supercruiser4925,2025-01-21T23:54:23+00:00,"32 days, 4:21:23",What's with the unwanted subtitles
ct_102,@BusinessLawReview,2025-01-21T19:00:08+00:00,"31 days, 23:27:08","报喜不报忧 --Chinese tend to tell you good things only. A lot of times, the so-called good things are made up."
ct_103,@maximpestsolutions3696,2025-01-21T15:09:08+00:00,"31 days, 19:36:08",Praying for all the Young across the World.It's Definitely going to get rough out there 🙏✝️💛.
ct_104,@ttemp2631,2025-01-21T14:52:22+00:00,"31 days, 19:19:22",Plenty of blue collar jobs in factories. The youth do not want to work in factories
ct_105,@tamoghnadas8581,2025-01-21T12:10:18+00:00,"31 days, 16:37:18","Not only China, its the same in India. GDP is growing but jobs aren't.Gig economy like food, grocery, package delivery and others are rapidly growing here too."
ct_106,@dufiasem,2025-01-21T02:31:36+00:00,"31 days, 6:58:36",4:18 what did the phone say?
ct_107,@Stephen_Jabs,2025-01-21T01:23:51+00:00,"31 days, 5:50:51",this happens even in Europe and America
ct_108,@Zoomerland,2025-01-21T00:24:03+00:00,"31 days, 4:51:03","""That meets my requirements."""
ct_109,@kh3777,2025-01-20T20:19:10+00:00,"31 days, 0:46:10",What's the problem with this unemployed youth cooking his own food at his home to save money instead of eating outside. He should downscale his ambitions of earning a high salary after leaving university.😮
ct_110,@kaizen_oiii1456,2025-01-20T06:36:50+00:00,"30 days, 11:03:50","Wait, tiktok is banned in china."
ct_111,@gengshutian,2025-01-19T11:02:22+00:00,"29 days, 15:29:22",Reportage avec qualite. Merci.
ct_112,@johngray7791,2025-01-19T10:30:43+00:00,"29 days, 14:57:43",I smell 💩
ct_113,@cyklopPL,2025-01-19T05:14:04+00:00,"29 days, 9:41:04",Fake news
ct_114,@cindymar1606,2025-01-18T22:40:39+00:00,"29 days, 3:07:39",In America all of our products come from china so youd think they are better off with all the business but nope the Chinese workers only earn 50 cents an hour so where is all the money and profit going to!?!?!? Yup the government. Just another example of greed.
ct_115,@Digibeatle09,2025-01-18T19:58:31+00:00,"29 days, 0:25:31","Economics is the “dismal science” - whilst it might be difficult to categorise China’s economy, it does share certain things with the economies of say, the United States and Europe and we have all seen economic “cycles” here in the West - of course, whether it’s some person higher up in the Communist Party or - here in the West - a politician who’s been elected by popular vote - the assurance that “there a quick fix” to these sort of issues runs hollow in the minds of many ….."
ct_116,@AmitSharma-ql5nr,2025-01-18T13:57:21+00:00,"28 days, 18:24:21","Dear French and German media - i think you have enough problem to look at your home country - rising unemployment, energy problem, healthcare. People are getting looted in day light in Paris. There are 100s of video in youtube where tourist have reported getting looted in European country.   No need to come to Asia to teach us."
ct_117,@joefox9765,2025-01-18T12:17:36+00:00,"28 days, 16:44:36",1 in 5 in city. In the country it's much higher 😢
ct_118,@Atomic_Mushroom,2025-01-18T04:34:40+00:00,"28 days, 9:01:40",the west is no better
ct_119,@FloatinBeeStingyButterfly,2025-01-18T01:46:43+00:00,"28 days, 6:13:43","Chinas situation is way worse than this. Because they hide all bad news, and give people a facade all the time, the world wouldn’t know. It’s the economic problems and the scammers in the society."
ct_120,@Quick-n-eg쿠이크앤이지,2025-01-17T23:35:03+00:00,"28 days, 4:02:03",차이나 needs Jesus Christ more than economic growth.
ct_121,@HeeHawCapital,2025-01-17T23:13:59+00:00,"28 days, 3:40:59",The worst documentary as you site dumb fuks and loosers w zero skills
ct_122,@nohopeequalsnofear3242,2025-01-17T22:28:15+00:00,"28 days, 2:55:15",Still safer & nicer than Detroit & SF
ct_123,@yourchannelname325,2025-01-17T16:48:44+00:00,"27 days, 21:15:44",stop filming these animals eating - it's disgusting
ct_124,@jsh12jho51,2025-01-17T16:41:24+00:00,"27 days, 21:08:24",Blame you fcking president and his CCP.Causing trouble to his own people and to other countries.OverturnThis president and his government
ct_125,@BbPp-dq7ei,2025-01-16T23:14:02+00:00,"27 days, 3:41:02",Who care
ct_126,@tutyathiyam2198,2025-01-16T21:13:33+00:00,"27 days, 1:40:33",Tianqing is already wealthy with the love of his family.
ct_127,@krishnaSagar69,2025-01-16T13:13:46+00:00,"26 days, 17:40:46","Spending more on anything doesn’t correlate in high returns anywhere. It’s when you spend less and get more is where the skill is.Frankly I don’t believe education is expensive anywhere. You can learn anywhere, thanks to the internet. It’s just how badly you want it."
ct_128,@larrysmith2123,2025-01-16T11:15:48+00:00,"26 days, 15:42:48",That Delivery guy is definitely not making 1500 euros a month. Don't believe he was allowed to be on camera as long he fakes his earnings to Western Media.
ct_129,@paulineagius8534,2025-01-16T10:04:46+00:00,"26 days, 14:31:46","Whoever the journalist is should honestly make more of an effort with Chinese names. If you’re going to do make a documentary about something, the least you can do is to at least try and pronounce things properly."
ct_130,@thatsrightmytype4144,2025-01-16T09:10:03+00:00,"26 days, 13:37:03",huhu god please put good faith in me.. and strengthen me..please me be discipline to achieve good habit and great track
ct_131,@BornAgainArmy,2025-01-16T04:27:23+00:00,"26 days, 8:54:23","Solution: Repent and obey. Your purpose in life is to prove yourself to your creator, not the pleasures of this world."
ct_132,@afr4847,2025-01-16T00:25:49+00:00,"26 days, 4:52:49",If these Chinese women want to move to the USA they can definitely stay with me 🔥
ct_133,@L.Cannon-s8f,2025-01-15T22:48:31+00:00,"26 days, 3:15:31","Well, I'm not Chinese and I think China's leadership is terrible. In fact, it sucks."
ct_134,@AllthingsFoodieTX,2025-01-15T12:10:35+00:00,"25 days, 16:37:35",I think worldwide the reason we’re seeing military building up worldwide. It’s not for fighting each other. It’s for the great tribulation and for when money is worth nothing anymore. The people are gonna go crazy so every country is getting there military government ready.
ct_135,@SaraanSarangi,2025-01-15T10:06:32+00:00,"25 days, 14:33:32","but if we look at India. this employment crisis seems fun and nothing, managing 1.4 billion with democracy would be like India. chinese people live much better standard of living than most of people in the world even in eastern europe"
ct_136,@SaraanSarangi,2025-01-15T09:54:58+00:00,"25 days, 14:21:58","at this point i feel like PPP per capita income is a lie. russian ppp per capita was low before war. and now look at it its booming. but in reality income is same as it was before GDP growth. In India or Bangladesh the situation is pretty much same. soon global south will see stagnation in this gdp growth even, alarming"
ct_137,@wilsonguo8642,2025-01-15T05:26:35+00:00,"25 days, 9:53:35",Ironic how china accused foreign countries of planting spies when there has been concrete evidence of them planting global spies in other nations
ct_138,@ravaechdeln4256,2025-01-14T21:29:43+00:00,"25 days, 1:56:43","Not a bad documentary, but please pronounce the Chinese names properly."
ct_139,@RARochester,2025-01-14T20:29:37+00:00,"25 days, 0:56:37","China is in trouble and will only get worse when the tariffs are imposed; trying to feed, house and employ so many is no easy task."
ct_140,@-Nastika,2025-01-14T12:58:24+00:00,"24 days, 17:25:24","3:41 The problem in china is dire indeed, but the translation should follow its meaning not just follow your own interpretation. The young man been interviewed said :”No job that meets my standard(decent and earns good money in his own perspective).” Not “but I haven’t found a job yet”. Which is quite quite different."
ct_141,@Spright91,2025-01-14T11:49:12+00:00,"24 days, 16:16:12",Studying journalism in China is like studying naval strategy in Mongolia.
ct_142,@danielt.8573,2025-01-14T08:11:36+00:00,"24 days, 12:38:36","Socialism doesn't work,. never has. Socialism is stealing."
ct_143,@timothybrown5741,2025-01-14T07:08:50+00:00,"24 days, 11:35:50",Yep blame the west. We have been propping up China for years.
ct_144,@Brightly1122,2025-01-14T05:51:51+00:00,"24 days, 10:18:51","China is 1.4 billions , the whole europe + US populations dont even 1.4 billions.So with such big population this is normal , just check how many compared to EU & US then make it into % .US cannot even solve its increasing destructive homelessness problem with only population 300mill, close to 1/5 of China population.700mill in China out of poverty , can whole Europe + US top this ??"
ct_145,@backpropagation8365,2025-01-14T04:01:28+00:00,"24 days, 8:28:28",I thought the Chinese were atheists. I see them praying. Has the cultural revolution failed? Mao is not gonna like it.
ct_146,@anniehills3580,2025-01-14T00:11:13+00:00,"24 days, 4:38:13",1 in 5? I think the young people must live with parents until they can find work!!
ct_147,@cassavamellin,2025-01-13T23:43:24+00:00,"24 days, 4:10:24",if they just kep the pee pee out of the  coke we would be fine
ct_148,@marlindagomez5766,2025-01-13T15:47:56+00:00,"23 days, 20:14:56",FAKE NEWS
ct_149,@tyq5775,2025-01-13T13:32:24+00:00,"23 days, 17:59:24","Since the COVID-19 pandemic, China's politics and economy have deteriorated. As a totalitarian, privileged, and corrupt party, the political defects of the CCP have been fully exposed. The democratic, free, and equal reforms that the people have longed for have become increasingly slim under the rule of the CCP. The private economy has been severely damaged, but the CCP is still constantly strengthening the privileges and welfare levels of its own organization and personnel. It neither accepts the supervision of the people nor allows the people to make any criticisms and objections. It enjoys its rights and interests, but ignores the basic economic and welfare needs of the people. The people's confidence in the future has seriously declined."
ct_150,@bugsbunnyalex,2025-01-13T09:49:17+00:00,"23 days, 14:16:17",Pronunciation of Qianqian made my head hurt lol
ct_151,@tombutler4184,2025-01-13T07:03:50+00:00,"23 days, 11:30:50","also, q is pronounced ch.... your statements lack authority when you cannot pronounce anything"
ct_152,@tombutler4184,2025-01-13T07:02:04+00:00,"23 days, 11:29:04","*unemployed, sry"
ct_153,@tombutler4184,2025-01-13T07:01:38+00:00,"23 days, 11:28:38","yes, this is the situation in all developed countries, and has been for 20 years in Britain. The British government hides the statistics too... 6 hours work a week means you are not employed"
ct_154,@marielosjauregui9065,2025-01-13T03:32:31+00:00,"23 days, 7:59:31",It's world wide....😢
ct_155,@tdtdtd1826,2025-01-13T02:05:22+00:00,"23 days, 6:32:22",Just the beginning.getting worse and worse
ct_156,@drphilgee6430,2025-01-12T13:35:28+00:00,"22 days, 18:02:28",Too much automation has created this situation....and it's only going to get worse
ct_157,@Marco_Hauser,2025-01-12T08:47:35+00:00,"22 days, 13:14:35",The young guy trying to convince his hard working and obviously quite poor parents to invest in a restaurant and basically playing all their hopes on this to break the cycle with a chance of succeeding below 10% is quite a signal of how desperate the situation must be
ct_158,@iGuide_net,2025-01-12T01:15:04+00:00,"22 days, 5:42:04",I helped my father grow corn and soybean in the 1970s. I learned how to hunt and fish and gut and prep the kill. Growing up in Mississippi this was normal.
ct_159,@costar1838,2025-01-11T17:03:58+00:00,"21 days, 21:30:58",Chine just sent $50 billion aid to Africa
ct_160,@midnightzen69,2025-01-11T16:40:38+00:00,"21 days, 21:07:38",the reporting is so western can you at least talk about china in a more constructive way? not everyone wants to live like the west.
ct_161,@isiisorisiaint,2025-01-11T12:39:33+00:00,"21 days, 17:06:33","so you show me a youngster complaining about about not finding a job in... journalism??? in china??? what did he expect he'll be writing about??? so basically he's pissed off for not being able to sing praises to the great communist party and get paid for that, what a tragic situation for the poor guy, good for him he can at least afford to eat out and doesn't need to kook for himself. And then that 20-something poor chick not being able to find a... manager position. Oh well, what a tragedy indeed"
ct_162,@jasminejeanine2239,2025-01-10T17:45:42+00:00,"20 days, 22:12:42","Yet they want those people to get married and have kids. They don't even have jobs. No, clearly we don't need more people."
ct_163,@DK-yz9xk,2025-01-10T11:54:59+00:00,"20 days, 16:21:59",😂😂😂 please don’t believe people who’s never been to China
ct_164,@NG-cx1mm,2025-01-10T11:04:53+00:00,"20 days, 15:31:53","This is a global situation, maybe the world should change it’s parameters for progress. Maybe it is not the income per capita that is the indicator of progress?"
ct_165,@CDRZee,2025-01-10T04:07:22+00:00,"20 days, 8:34:22",Chinese leadership is fearful of reporters!  Imagine that!  The China Era is over!  Decoupling is growing in stride!   Grand buildings are just a facade.
ct_166,@OctavioLopezMaldonado,2025-01-10T02:57:57+00:00,"20 days, 7:24:57",PROPAGANDA! ❤🔥
ct_167,@OctavioLopezMaldonado,2025-01-10T02:57:41+00:00,"20 days, 7:24:41","At least in China people have shelter and food, in the United States they don't even have a health system! 🔥❤"
ct_168,@OctavioLopezMaldonado,2025-01-10T02:55:11+00:00,"20 days, 7:22:11",In Spain the youth unemployment rate is 25%! 😢
ct_169,@OctavioLopezMaldonado,2025-01-10T02:53:09+00:00,"20 days, 7:20:09","In Europe is worst, with what nerve do you dare to criticize China? 😂😂😂😂😂"
ct_170,@calcarr3211,2025-01-09T15:34:37+00:00,"19 days, 20:01:37",This is happening everywhere but it is probably worse in China because pf the massive population and academic competition 😮‍💨
ct_171,@247-v4h,2025-01-09T07:15:45+00:00,"19 days, 11:42:45","PROTECT HOMELAND AND LOVE ONES!!!​​(Not Macau, Taiwan, Hong Kong)CHINA criminal groups linger around my home shout ""destroy everyone's life, just want land, assets,money by sending more CHINA people to my homeland and pay THE DIRTY MONEY to the people origin from CHINA,CHINA STUDENT, FAKE MARRIAGE, IMMIGRANTS, ILLEGAL construction worker, ILLEGAL delivery worker , ILLEGAL restaurant worker to destroy our homeland,system public order, eventually destroy the everyone and land, rob the money...... (history learnt from CHINA ancient history)"
ct_172,@cliffto2309,2025-01-08T23:36:09+00:00,"19 days, 4:03:09",lol having statue of a dictator in the house. How brainwashed .
ct_173,@fabriziosalinaro6168,2025-01-08T09:24:25+00:00,"18 days, 13:51:25","18:08 - The city in the video is Milan, Italy!"
ct_174,@BORISUNITONE,2025-01-08T07:39:14+00:00,"18 days, 12:06:14",2:29 Bro put the whole bottle of laundry detergent into the machine 😆
ct_175,@vihodanyet,2025-01-08T00:01:48+00:00,"18 days, 4:28:48","Considering there is a banner below the video to inform the viewer that this channel is in part funded by the French and German governments, I find it hilarious how low budget they went on this documentary.1st the pronounciations of the Chinese names whether it be cities, people.. it’s diabolical attempt.2nd the overt Xi Jinping boogeyman narrative is just silly"
ct_176,@vihodanyet,2025-01-07T23:33:51+00:00,"18 days, 4:00:51",3:25 .. whoever did the subtitle translation did a really terrible and low effort job. They missed 60% of what he was saying..
ct_177,@alter1237,2025-01-07T21:16:25+00:00,"18 days, 1:43:25",did you say zengzu? hhhh
ct_178,@PeterRudesindus,2025-01-07T14:05:35+00:00,"17 days, 18:32:35",western elites are salvating at the potential low hiring costs of bigger and bigger waves of immigrants.
ct_179,@Leon-XR,2025-01-07T13:06:13+00:00,"17 days, 17:33:13","If you can't even say any chinese word right it just shows how clueless you are about China... his name is pronounced TIANCHIN, not TIANKIN. Clueless lazy journalists...."
ct_180,@philippechaniet5837,2025-01-07T11:12:45+00:00,"17 days, 15:39:45","Exactly like Japan in the 1990s following the bursting of the real estate bubble. Same causes, same consequences?"
ct_181,@jackleroy3585,2025-01-07T01:06:10+00:00,"17 days, 5:33:10",journalism is sort of a useless degree.Should have taken a stem degree.
ct_182,@kurisu100,2025-01-06T19:00:36+00:00,"16 days, 23:27:36","No school certificate, no real job future but having 3 kids. I really start to hate those people."
ct_183,@stephaniehale946,2025-01-06T17:12:58+00:00,"16 days, 21:39:58",*China is a facade.*
ct_184,@iirgendsonTyp,2025-01-06T11:13:47+00:00,"16 days, 15:40:47",If you study journalism in china you cant be very bright
ct_185,@aquilesbrinco8778,2025-01-06T09:28:26+00:00,"16 days, 13:55:26","I liked the video but still cant help feeling uneasy in the way this media piece and others talk about China as being wholly lead by its president like some dictator. What is the objective being seeked in this situation? These problems are structural, not totally related to a single person or group of infividuals. The problem isnt even unique to China tho cause both countries Im a citizen to have the same problem. These are problems greatly tied to the global economic machine, inequality is only widening worldwide. Perhaps it is time we ALL reconsider what systems we are working towards and how possible concepts might work in practical applicationsIdk im in my mid 20s and co sider myself hopeful for the good days to vome, but sometimes cant help in feeling the overwhelming anxieties of how deep and fast its all heading downhill. May it be the hard times before breakthrough. We dont deserve to live in a world where finding stability is seen as a near-impossibility: specially when theres so many of us and we can all help each other"
ct_186,@PieterJanDelbecke,2025-01-06T09:13:56+00:00,"16 days, 13:40:56",journalism and marketing...
ct_187,@johnqpublic4012,2025-01-06T04:31:45+00:00,"16 days, 8:58:45","There's exactly zero chance that Erchui currently earns $1500 EUR (~11,340rmb) per month right now at just 8 hrs/day.Maybe 5 years ago, but not today. He'd need to consistently deliver 5-10 orders per hour (minimum) and clear 5-10rmb per order (which I seriously doubt).These days, it's an over-saturated occupation much like ride hailing. Too many riders competing for too few orders. For the few orders they do manage to get, tips are virtually nonexistent.I'd be surprised if he's making half of what he claims. I wonder if he was simply saving face for the interview."
ct_188,@TT-dp8qh,2025-01-05T23:33:58+00:00,"16 days, 4:00:58",China recently losts in Trillions for Westerners' factories moved out of CN!
ct_189,@TT-dp8qh,2025-01-05T23:22:29+00:00,"16 days, 3:49:29",That country loves to fight. It develops and build more military power to impress its own and creates more tension to its neighboring countries!
ct_190,@thierryb2826,2025-01-05T17:11:05+00:00,"15 days, 21:38:05","Comparativement au nombre d'habitants, la France est à un pire niveau que la Chine, avec le terrorisme en plus."
ct_191,@pekingerleben,2025-01-05T09:43:20+00:00,"15 days, 14:10:20","""Just a facade""... are you kidding me? Chinas currency is backed up with more gold than every. When you talk about the usa doiletpaper you may say that this is just a facade, NOT CHINA. Greetings from Beijing."
ct_192,@bartonlee3594,2025-01-05T01:26:03+00:00,"15 days, 5:53:03",So sad. The China Dream has become a China Nightmare for the young people.
ct_193,@jefferylorance7988,2025-01-04T18:41:28+00:00,"14 days, 23:08:28",Freedom creates a better life.  When government stops the freedom to speak…and listen….this is a start to another revolution…a cycle China goes through…study this..
ct_194,@Master-master3,2025-01-04T07:44:10+00:00,"14 days, 12:11:10",Govt doesnt want them to contact foreigners because they can be spies. Of course unemployed young people poses many govt secrets
